"","PubMedID","Title","abstracts"
"18","30533399","Potential Pandemic of H7N9 Avian Influenza A Virus in Human.","
        Since 2013, the H7N9 avian influenza A virus (AIV) has caused human infections and to the extent of now surpassing H5N1. This raises an alarm about the potential of H7N9 to become a pandemic problem. Our compilation of the amino acid changes required for AIVs to cross the species-barrier discovers 58 that have very high proportions in both the human- and avian-isolated H7N9 viruses. These changes correspond with sporadic human infections that continue to occur in regions of avian infections. Among the six internal viral genes, amino acid changes do not differ significantly between H9N2 and H7N9, except for V100A in PA, and K526R, D627K, and D701N in PB2. H9N2 AIVs provide internal genes to H7N9. Most of the amino acid changes in H7N9 appear to come directly from H9N2. Seventeen amino acid substitutions appear to have fixed quickly by the 5th wave. Among these, six amino acid sites in HA1 are receptor binding sites, and PB2-A588V was shown to promote the adaptation of AIVs to mammals. The accelerated fixation of mutations may promote the adaptation of H7N9 to human, but need further functional evidence. Although H7N9 AIVs still cannot efficiently transmit between humans, they have the genetic makeup associated with human infections. These viruses must be controlled in poultry to remove the threat of it becoming a human pandemic event.
      "
"19","30069787","Zoonotic Influenza and Human Health-Part 2: Clinical Features, Diagnosis, Treatment, and Prevention Strategies.","
        <AbstractText Label=""PURPOSE OF REVIEW"" NlmCategory=""OBJECTIVE"">Zoonotic influenza viruses are those influenza viruses that cross the animal-human barrier and can cause disease in humans, manifesting from minor respiratory illnesses to multiorgan dysfunction. The increasing incidence of infections caused by these viruses worldwide has necessitated focused attention to improve both diagnostic as well as treatment modalities. In this second part of a two-part review, we discuss the clinical features, diagnostic modalities, and treatment of zoonotic influenza, and provide an overview of prevention strategies.
        <AbstractText Label=""RECENT FINDINGS"" NlmCategory=""RESULTS"">Illnesses caused by novel reassortant avian influenza viruses continue to be detected and described; most recently, a human case of avian influenza A(H7N4) has been described from China. We continue to witness increasing rates of A(H7N9) infections, with the latest (fifth) wave, from late 2016 to 2017, being the largest to date. The case fatality rate for A(H7N9) and A(H5N1) infections among humans is much higher than that of seasonal influenza infections. Since the emergence of the A(H1N1) 2009 pandemic, and subsequently A(H7N9), testing and surveillance for novel influenzas have become more effective. Various newer treatment options, including peramivir, favipiravir (T-705), and DAS181, and human or murine monoclonal antibodies have been evaluated in vitro and in animal models. Armed with robust diagnostic modalities, antiviral medications, vaccines, and advanced surveillance systems, we are today better prepared to face a new influenza pandemic and to limit the burden of zoonotic influenza than ever before. Sustained efforts and robust research are necessary to efficiently deal with the highly mutagenic zoonotic influenza viruses.
      "
"20","30069735","Zoonotic Influenza and Human Health-Part 1: Virology and Epidemiology of Zoonotic Influenzas.","
        <AbstractText Label=""PURPOSE OF REVIEW"" NlmCategory=""OBJECTIVE"">Zoonotic influenza viruses are those that cross the animal-human barrier and can cause disease in humans, manifesting from minor respiratory illnesses to multiorgan dysfunction. They have also been implicated in the causation of deadly pandemics in recent history. The increasing incidence of infections caused by these viruses worldwide has necessitated focused attention to improve both diagnostic as well as treatment modalities. In this first part of a two-part review, we describe the structure of zoonotic influenza viruses, the relationship between mutation and pandemic capacity, pathogenesis of infection, and also discuss history and epidemiology.
        <AbstractText Label=""RECENT FINDINGS"" NlmCategory=""RESULTS"">We are currently witnessing the fifth and the largest wave of the avian influenza A(H7N9) epidemic. Also in circulation are a number of other zoonotic influenza viruses, including avian influenza A(H5N1) and A(H5N6); avian influenza A(H7N2); and swine influenza A(H1N1)v, A(H1N2)v, and A(H3N2)v viruses. Most recently, the first human case of avian influenza A(H7N4) infection has been documented. By understanding the virology and epidemiology of emerging zoonotic influenzas, we are better prepared to face a new pandemic. However, continued effort is warranted to build on this knowledge in order to efficiently combat the constant threat posed by the zoonotic influenza viruses.
      "
"21","29475453","Whole transcriptome analysis reveals differential gene expression profile reflecting macrophage polarization in response to influenza A H5N1 virus infection.","
        <AbstractText Label=""BACKGROUND"">Avian influenza A H5N1 virus can cause lethal disease in humans. The virus can trigger severe pneumonia and lead to acute respiratory distress syndrome. Data from clinical, in vitro and in vivo suggest that virus-induced cytokine dysregulation could be a contributory factor to the pathogenesis of human H5N1 disease. However, the precise mechanism of H5N1 infection eliciting the unique host response are still not well understood.
        <AbstractText Label=""METHODS"">To obtain a better understanding of the molecular events at the earliest time points, we used RNA-Seq to quantify and compare the host mRNA and miRNA transcriptomes induced by the highly pathogenic influenza A H5N1 (A/Vietnam/3212/04) or low virulent H1N1 (A/Hong Kong/54/98) viruses in human monocyte-derived macrophages at 1-, 3-, and 6-h post infection.
        <AbstractText Label=""RESULTS"">Our data reveals that two macrophage populations corresponding to M1 (classically activated) and M2 (alternatively activated) macrophage subtypes respond distinctly to H5N1 virus infection when compared to H1N1 virus or mock infection, a distinction that could not be made from previous microarray studies. When this confounding variable is considered in our statistical model, a clear set of dysregulated genes and pathways emerges specifically in H5N1 virus-infected macrophages at 6-h post infection, whilst was not found with H1N1 virus infection. Furthermore, altered expression of genes in these pathways, which have been previously implicated in viral host response, occurs specifically in the M1 subtype. We observe a significant up-regulation of genes in the RIG-I-like receptor signaling pathway. In particular, interferons, and interferon-stimulated genes are broadly affected. The negative regulators of interferon signaling, the suppressors of cytokine signaling, SOCS-1 and SOCS-3, were found to be markedly up-regulated in the initial round of H5N1 virus replication. Elevated levels of these suppressors could lead to the eventual suppression of cellular antiviral genes, contributing to pathophysiology of H5N1 virus infection.
        <AbstractText Label=""CONCLUSIONS"">Our study provides important mechanistic insights into the understanding of H5N1 viral pathogenesis and the multi-faceted host immune responses. The dysregulated genes could be potential candidates as therapeutic targets for treating H5N1 disease.
      "
"22","28715148","Lineage-specific epitope profiles for HPAI H5 pre-pandemic vaccine selection and evaluation.","
        <AbstractText Label=""BACKGROUND"">Multiple highly pathogenic avian influenza (HPAI) H5 viruses continue to co-circulate. This has complicated pandemic preparedness and confounded effective vaccine candidate selection and evaluation.
        <AbstractText Label=""OBJECTIVES"">In this study, we aimed to predict and map the diversity of CD8+ T-cell epitopes among H5 hemagglutinin (HA) gene lineages to estimate CD8+ T-cell immunity in humans induced by vaccine candidates.
        <AbstractText Label=""METHODS"">A dataset consisting of 1125 H5 HA sequences collected between 1996 and 2017 from avian and humans was assembled for phylogenetic and lineage-specific epitope analyses. Conserved epitopes were predicted from WHO-endorsed vaccine candidates and representative clade-defining strains by pairwise comparison with Immune Epitope Database (IEDB). The distribution of predicted epitopes was mapped to each HPAI H5 lineage. We assume that high similarity and conservancy of predicted epitopes from vaccine candidates among all circulating HPAI H5 lineages is correlated with high immunity.
        <AbstractText Label=""RESULTS"">A total of 49 conserved CD8+ T-cell epitopes were predicted at 28 different amino acid positions of the HA protein. Mapping these epitopes to the phylogenetic tree allowed us to develop epitope profiles, or ""fingerprints,"" for each HPAI H5 lineage. Vaccine epitope percentage analyses showed some epitope profiles were highly conserved for all H5 isolates and may be valuable for universal vaccine design. However, the positions with low coverage may explain why the vaccine candidates do not always function well.
        <AbstractText Label=""CONCLUSIONS"">These findings demonstrate that our analytical approach to evaluate conserved CD8+ T-cell epitope prediction in a phylogenetic framework may provide important insights for computational design of vaccine selection and future epitope-based design.
        © 2017 The Authors. Influenza and Other Respiratory Viruses Published by John Wiley &amp; Sons Ltd.
      "
"23","28498306","A Conserved Residue, Tyrosine (Y) 84, in H5N1 Influenza A Virus NS1 Regulates IFN Signaling Responses to Enhance Viral Infection.","
        The non-structural protein, NS1, is a virulence factor encoded by influenza A viruses (IAVs). In this report, we provide evidence that the conserved residue, tyrosine (Y) 84, in a conserved putative SH2-binding domain in A/Duck/Hubei/2004/L-1 [H5N1] NS1 is critical for limiting an interferon (IFN) response to infection. A phenylalanine (F) substitution of this Y84 residue abolishes NS1-mediated downregulation of IFN-inducible STAT phosphorylation, and surface IFNAR1 expression. Recombinant IAV (rIAV) [H1N1] expressing A/Grey Heron/Hong Kong/837/2004 [H5N1] NS1-Y84F (rWSN-GH-NS1-Y84F) replicates to lower titers in human lung epithelial cells and is more susceptible to the antiviral effects of IFN-β treatment compared with rIAV expressing the intact H5N1 NS1 (rWSN-GH-NS1-wt). Cells infected with rWSN-GH-NS1-Y84F express higher levels of IFN stimulated genes (ISGs) associated with an antiviral response compared with cells infected with rWSN-GH-NS1-wt. In mice, intranasal infection with rWSN-GH-NS1-Y84F resulted in a delay in onset of weight loss, reduced lung pathology, lower lung viral titers and higher ISG expression, compared with mice infected with rWSN-GH-NS1-wt. IFN-β treatment of mice infected with rWSN-GH-NS1-Y84F reduced lung viral titers and increased lung ISG expression, but did not alter viral titers and ISG expression in mice infected with rWSN-GH-NS1-wt. Viewed altogether, these data suggest that the virulence associated with this conserved Y84 residue in NS1 is, in part, due to its role in regulating the host IFN response.
      "
"24","27714746","Burden of acute respiratory disease of epidemic and pandemic potential in the WHO Eastern Mediterranean Region: A literature review.","
        There are gaps in the knowledge about the burden of severe respiratory disease in the Eastern Mediterranean Region (EMR). This literature review was therefore conducted to describe the burden of epidemicand pandemic-prone acute respiratory infections (ARI) in the Region which may help in the development of evidence-based disease prevention and control policies. Relevant published and unpublished reports were identified from searches of various databases; 83 documents fulfilled the search criteria. The infections identified included: ARI, avian influenza A(H5N1), influenza A(H1N1)pdm09 and Middle East respiratory syndrome coronavirus (MERS-CoV) infection. Pneumonia and ARIs were leading causes of disease and death in the Region. Influenza A(H1N1) was an important cause of morbidity during the 2009 pandemic. This review provides a descriptive summary of the burden of acute respiratory diseases in the Region, but there still remains a lack of necessary data.
      "
"25","27080193","Avian influenza viruses that cause highly virulent infections in humans exhibit distinct replicative properties in contrast to human H1N1 viruses.","
        Avian influenza viruses present an emerging epidemiological concern as some strains of H5N1 avian influenza can cause severe infections in humans with lethality rates of up to 60%. These have been in circulation since 1997 and recently a novel H7N9-subtyped virus has been causing epizootics in China with lethality rates around 20%. To better understand the replication kinetics of these viruses, we combined several extensive viral kinetics experiments with mathematical modelling of in vitro infections in human A549 cells. We extracted fundamental replication parameters revealing that, while both the H5N1 and H7N9 viruses replicate faster and to higher titers than two low-pathogenicity H1N1 strains, they accomplish this via different mechanisms. While the H7N9 virions exhibit a faster rate of infection, the H5N1 virions are produced at a higher rate. Of the two H1N1 strains studied, the 2009 pandemic H1N1 strain exhibits the longest eclipse phase, possibly indicative of a less effective neuraminidase activity, but causes infection more rapidly than the seasonal strain. This explains, in part, the pandemic strain's generally slower growth kinetics and permissiveness to accept mutations causing neuraminidase inhibitor resistance without significant loss in fitness. Our results highlight differential growth properties of H1N1, H5N1 and H7N9 influenza viruses.
      "
"26","24603885","Populations at risk for severe or complicated Avian Influenza H5N1: a systematic review and meta-analysis.","
        <AbstractText Label=""BACKGROUND"" NlmCategory=""BACKGROUND"">Little is known about risk factors for severe outcomes in patients infected with H5N1 and no systematic review has been conducted. Understanding risk factors is an important step for prioritizing prophylaxis or treatment in the event of a pandemic.
        <AbstractText Label=""OBJECTIVES"" NlmCategory=""OBJECTIVE"">To systematically evaluate risk factors for severe outcomes in patients with avian influenza H5N1 infection.
        <AbstractText Label=""DATA SOURCES"" NlmCategory=""METHODS"">MEDLINE, EMBASE, CINAHL, GlobalHealth, and CENTRAL through March 2011.
        <AbstractText Label=""ELIGIBILITY CRITERIA FOR SELECTING STUDIES"" NlmCategory=""METHODS"">Observational studies of any design published in English, French, Spanish, German or Korean that reported on risk factor-outcome combinations of interest in participants with confirmed H5N1 infections. Outcomes considered included death, ventilator support, hospital and ICU admission, pneumonia, and composite outcomes.
        <AbstractText Label=""STUDY APPRAISAL"" NlmCategory=""METHODS"">Risk of bias was assessed using the Newcastle-Ottawa scale (NOS).
        <AbstractText Label=""RESULTS"" NlmCategory=""RESULTS"">We identified 20 studies reporting on 999 patients infected with H5N1. The majority of studies (n = 14, 70%) were at intermediate risk of bias, i.e. 4-6 points on the NOS. Females were at increased risk of death (OR 1.75, 95% CI 1.27-2.44), while young age, in particular &lt;5 years of age (OR 0.44, 95% CI 0.25-0.79 for death), was protective. Data on traditional risk factors was scarce and requires further studies. Another major limitation in the published literature was lack of adjustment for confounders.
        <AbstractText Label=""INTERPRETATION"" NlmCategory=""CONCLUSIONS"">Females were at increased risk for complications following H5N1 infection while young age protected against severe outcomes. Research on traditional risk factors was limited and is required.
      "
"27","24204709","Evaluation of alignment algorithms for discovery and identification of pathogens using RNA-Seq.","
        Next-generation sequencing technologies provide an unparallelled opportunity for the characterization and discovery of known and novel viruses. Because viruses are known to have the highest mutation rates when compared to eukaryotic and bacterial organisms, we assess the extent to which eleven well-known alignment algorithms (BLAST, BLAT, BWA, BWA-SW, BWA-MEM, BFAST, Bowtie2, Novoalign, GSNAP, SHRiMP2 and STAR) can be used for characterizing mutated and non-mutated viral sequences--including those that exhibit RNA splicing--in transcriptome samples. To evaluate aligners objectively we developed a realistic RNA-Seq simulation and evaluation framework (RiSER) and propose a new combined score to rank aligners for viral characterization in terms of their precision, sensitivity and alignment accuracy. We used RiSER to simulate both human and viral read sequences and suggest the best set of aligners for viral sequence characterization in human transcriptome samples. Our results show that significant and substantial differences exist between aligners and that a digital-subtraction-based viral identification framework can and should use different aligners for different parts of the process. We determine the extent to which mutated viral sequences can be effectively characterized and show that more sensitive aligners such as BLAST, BFAST, SHRiMP2, BWA-SW and GSNAP can accurately characterize substantially divergent viral sequences with up to 15% overall sequence mutation rate. We believe that the results presented here will be useful to researchers choosing aligners for viral sequence characterization using next-generation sequencing data.
      "
"28","22706187","The current state of H5N1 vaccines and the use of the ferret model for influenza therapeutic and prophylactic development.","
        Highly pathogenic avian influenza H5N1 is a threat to global public health as a natural pandemic causing agent but has recently been considered a bioterrorism concern.  The evolving view of the H5N1 virus necessitates the re-evaluation of the current status of H5N1 therapeutics and prophylactics, in particular the preparation of viable H5N1 vaccination strategies as well as the use of ferrets in influenza research.  Here the highly pathogenic H5N1 virus dilemma is discussed in context with the current H5N1 vaccine status and the use of the ferret model.  Previously, the development of various H5N1 vaccine platforms have been attempted, many of them tested in the ferret model, including vector vaccines, adjuvant vaccines, DNA vaccines, and reverse engineered vaccines. Moreover, as ferrets are a superlative animal model for influenza investigation and vaccine testing, it is imperative that this model is recognized for its uses in prophylactic development and not only as an agent for creating transmissible influenza viruses.  Elucidating the ferret immune response and creating ferret immune reagents remain important goals in conjunction with the development and manufacture of H5N1 vaccines.  In summary, an efficacious H5N1 vaccine is urgently needed and the ferret model remains an appropriate model for its development.
      "
"29","22068147","Do viral infections mimic bacterial sepsis? The role of microvascular permeability: A review of mechanisms and methods.","
        A dysregulated immune response and functional immunosuppression have been considered the major mechanisms of the bacterial sepsis syndrome. More recently, the loss of endothelial barrier function and resultant microvascular leak have been found to be a key determinant of the pathogenesis of bacterial sepsis. Whether a similar paradigm applies to systemic viral syndromes is not known. Answering this question has far-reaching implications for the development of future anti-viral therapeutic strategies. In this review, we provide an overview of the structure and function of the endothelium and how its barrier integrity is compromised in bacterial sepsis. The various in vitro and in vivo methodologies available to investigate vascular leak are reviewed. Emphasis is placed on the advantages and limitations of cell culture techniques, which represent the most commonly used methods. Within this context, we appraise recent studies of three viruses - hantavirus, human herpes virus 8 and dengue virus - that suggest microvascular leak may play a role in the pathogenesis of these viral infections. We conclude with a discussion of how endothelial barrier breakdown may occur in other viral infections such as H5N1 avian influenza virus.
        Copyright © 2011 Elsevier B.V. All rights reserved.
      "
"30","21791660","Rapid immunization against H5N1: a randomized trial evaluating homologous and cross-reactive immune responses to AS03(A)-adjuvanted vaccination in adults.","
        <AbstractText Label=""BACKGROUND"" NlmCategory=""BACKGROUND"">Accelerated immunization schedules may help gain early control of influenza pandemics. We investigated different schedules of an AS03(A)-adjuvanted H5N1 vaccine.
        <AbstractText Label=""METHODS"" NlmCategory=""METHODS"">This phase II, open-label, 6-month study randomized participants (aged 18-64 years) to 2 vaccine doses administered 21 (standard schedule), 14, or 7 days apart, or on the same day. Coprimary end points were that the lower limit of the 98.75% confidence interval 14 days after the last dose must be (1) &gt;40% for seroconversion rate (SCR) (Center for Biologics Evaluation and Research [CBER] criterion) and (2) &gt;50% for seroprotection rate (SPR) (attainment rate for reciprocal hemagglutination inhibition titers ≥40, protocol-defined criterion) for the vaccine homologous strain (A/Indonesia/5/2005). European Committee for Human Medicinal Products (CHMP) immunogenicity criteria were also evaluated.
        <AbstractText Label=""RESULTS"" NlmCategory=""RESULTS"">Coprimary end points were achieved (lower 98.75% confidence intervals exceeded defined values). Titers were highest with the standard schedule. Nevertheless, CBER SCR, protocol-defined SPR, and CHMP criteria were met with all schedules for the A/Indonesia/5/2005 strain. There were no significant differences between age groups (18-40 vs 41-64 years). Immune response was robust against drift variants A/turkey/Turkey/1/2005 and A/Vietnam/1194/2004.
        <AbstractText Label=""CONCLUSIONS"" NlmCategory=""CONCLUSIONS"">The AS03(A)-adjuvanted H5N1 vaccine in accelerated schedules offers a robust immune response against vaccine homologous and drift variant strains, allowing consideration of compressed vaccination intervals.
        <AbstractText Label=""CLINICAL TRIALS REGISTRATION"" NlmCategory=""BACKGROUND"">NCT00695669.
      "
"31","21195111","Early detection of influenza A(H5) viruses with affinity for the human sialic acid receptor by MALDI-TOF mass spectrometry based mutation detection.","
        Highly pathogenic avian influenza (HPAI) A(H5N1) strains have been causing sporadic cases of disease in South East Asia and Africa for many years. These cases are associated with a high fatality rate, and it is feared that the virus could evolve into a strain capable of causing a pandemic. It is likely that a requirement for a A(H5) pandemic to occur is a switch in the receptor affinity of the virus. Candidate mutations in the hemagglutinin glycoprotein have been identified in the literature, and their emergence in circulating viruses would be an ominous development. This study describes a method to identify the presence of these mutations, even within a quasispecies, using RT-PCR followed by in vitro translation and peptide characterization by MALDI-TOF mass spectrometry.
        Copyright © 2011 Elsevier B.V. All rights reserved.
      "
"32","21146544","Highly pathogenic avian influenza outbreak mitigated by seasonal low pathogenic strains: insights from dynamic modeling.","
        The spread of highly pathogenic avian influenza (HPAI) H5N1 remains a threat for both wild and domestic bird populations, while low pathogenic avian influenza (LPAI) strains have been reported to induce partial immunity to HPAI in poultry and some wild birds inoculated with both HPAI and LPAI strains. Here, based on the reported data and experiments, we develop a two-strain avian influenza model to examine the extent to which this partial immunity observed at the individual level can affect the outcome of the outbreaks among migratory birds in the wild at the population level during different seasons. We find a distinct mitigating effect of LPAI on the death toll induced by HPAI strain, and this effect is particularly important for populations previously exposed to and recovered from LPAI. We further investigate the effect of the dominant mode of transmission of an HPAI strain on the outcome of the epidemic. Four combinations of contact based direct transmission and indirect fecal-to-oral (or environmental) routes are examined. For a given infection peak of HPAI, indirect fecal-to-oral transmission of HPAI can lead to a higher death toll than that associated with direct transmission. The mitigating effect of LPAI can, in turn, be dependent on the route of infection of HPAI.
        Copyright Â© 2010 Elsevier Ltd. All rights reserved.
      "
